date,slug,title,description,url3/10/15,issues,"Which Issues Each Party Debates, or Ignores",Based on an analysis of debate transcripts. With Karen Yourish.,http://www.nytimes.com/interactive/2016/03/11/us/elections/what-parties-debate-or-ignore.html2/26/15,faces,The Faces of American Power,With Haeyoun Park and Josh Williams.,http://www.nytimes.com/interactive/2016/02/26/us/race-of-american-power.html2/15/15,scotus,Supreme Court Nominees Considered in Election Years Are Usually Confirmed,"The history of Supreme Court nominations, published in the days after Justice Antonin Scalia&rsquo;s death. With Gregor Aisch, K.K. Rebecca Lai and Karen Yourish.",http://www.nytimes.com/interactive/2016/02/15/us/supreme-court-nominations-election-year-scalia.html2/2/15,primaries,"Which States Trump, Cruz and Rubio Need to Win",A visualization of the landscape of the presidential race after Iowa for the leading Republican candidates. With Nate Cohn.,http://www.nytimes.com/interactive/2016/02/02/us/cruz-trump-rubio-nomination-paths.html12/10/15,sales,Gun Sales Soar After Obama Calls for New Restrictions,"What drives gun sales in the United States, which has far more civilian firearms than any other country. Gregor Aisch and I released the <a href='https://github.com/NYTimes/gunsales'>data and code</a> behind our analysis on Github.",http://www.nytimes.com/interactive/2015/12/10/us/gun-sales-terrorism-obama-restrictions.html11/12/15,traffickers,How Gun Traffickers Get Around State Gun Laws,"A visual story on the underground market for guns, which tend to travel from states with weak gun laws to states with strict gun laws. With Gregor Aisch.",http://www.nytimes.com/interactive/2015/11/12/us/gun-traffickers-smuggling-state-gun-laws.html15-Oct,guns,How They Got Their Guns,"An examination of where 14 mass public shooters got their guns. At least eight had criminal histories or known mental health issues before buying them legally. With Larry Buchanan, Richard A. Oppel, Jr. and Daniel Victor.",http://www.nytimes.com/interactive/2015/10/03/us/how-mass-shooters-got-their-guns.html15-Oct,ads,The Cost of Mobile Ads on 50 News Websites,We measured the mix of advertising and editorial on the mobile home pages of the top 50 news websites and found that more than half of all data came from ads and other content filtered by ad blockers. With Gregor Aisch and Wilson Andrews.,http://www.nytimes.com/interactive/2015/10/01/business/cost-of-mobile-ads.html15-Sep,borders,Closing the Back Door to Europe,"Parts of the main route into Europe were blocked with razor-wire fences and other border controls, forcing migrants to take more dangerous paths. With Sarah Almukhtar and Derek Watkins.",http://www.nytimes.com/interactive/2015/09/15/world/europe/migrant-borders-europe.html15-Aug,chemicals,Tianjin Blasts Expose the Dangerous Proximity of Toxic Chemicals in China,"After a deadly chemical warehouse explosion in Tianjin, we analyzed satellite photos to show that chemical facilities across China were dangerously close to schools, residential areas and major roads. With Patrick Boehler, K.K. Rebecca Lai, Vanessa Piao and Crystal Tse.",http://www.nytimes.com/interactive/2015/08/21/world/asia/tianjin-china-explosion-hazardous-chemical-sites.html15-Jul,china-investments,The World According to China,"Where China has outsized influence around the world, based on an analysis of the foreign investments of every country in the world. With Gregor Aisch and K.K. Rebecca Lai.",http://www.nytimes.com/interactive/2015/07/24/business/international/the-world-according-to-china-investment-maps.html15-May,drought,Your Contribution to the California Drought,The average American consumes more than 300 gallons of California water each week by eating food that was produced there. With Larry Buchanan and Haeyoun Park.,http://www.nytimes.com/interactive/2015/05/21/us/your-contribution-to-the-california-drought.html15-Feb,timewarner,Stream of Foreign Wealth Flows to Elite New York Real Estate,"Motion graphics for an investigation into secret real estate ownership. Partly in response, the Treasury Department <a href='http://www.nytimes.com/2016/01/14/us/us-will-track-secret-buyers-of-luxury-real-estate.html'>began identifying</a> and tracking secret buyers of high-end properties. With Louise Story, Stephanie Saul, Tom Giratikanon, Mika Gr&ouml;ndahl, Yuliya Parshina-Kottas, Graham Roberts and Jeremy White.",http://www.nytimes.com/2015/02/08/nyregion/stream-of-foreign-wealth-flows-to-time-warner-condos.html14-Jul,plagiarism,How Senator John Walsh Plagiarized a Final Paper,"Graphic showing how a senator took most of a 2007 final paper required for his master&rsquo;s degree from other sources without proper attribution. Two weeks after the story and graphic were published, Mr. Walsh dropped his election bid. Story by Jonathan Martin; graphic with Matthew Ericson and Nick Corasiniti.",http://www.nytimes.com/interactive/2014/07/23/us/politics/john-walsh-final-paper-plagiarism.html14-Jul,toll,"The Toll in Gaza and Israel, Day by Day",A 29-day visual diary of violence between Israel and Hamas. With Karen Yourish and many others.,http://www.nytimes.com/interactive/2014/07/15/world/middleeast/toll-israel-gaza-conflict.html14-Jun,soccer-styles,How We Play the Game,Diagramming classic goals for a series of essays on soccer and national character. With Andrew Das and Alicia DeSantis.,http://www.nytimes.com/interactive/2014/06/15/sports/worldcup/how-we-play.html14-Jun,ball,The World&rsquo;s Ball,"Exploding soccer balls. With Alicia DeSantis, Mika Gr&ouml;ndahl, Josh Keller, Graham Roberts and Bedel Saget.",http://www.nytimes.com/interactive/2014/06/13/sports/worldcup/world-cup-balls.html?ref=worldcup14-Apr,winston,"A Star Player Accused, and a Flawed Rape Investigation",Design and graphics for an investigation by Walt Bogdanich into how Florida State mishandled an accusation that its star quarterback raped a student. The piece was the first in a series that was a finalist for a <a href='http://www.pulitzer.org/finalists/5380'>Pulitzer Prize</a>. With Wilson Andrews and Meghan Louttit.,http://www.nytimes.com/interactive/2014/04/16/sports/errors-in-inquiry-on-rape-allegations-against-fsu-jameis-winston.html14-Mar,mudslide,Houses in the Path of the Washington Mudslide,"With Alan Blinder, Larry Buchanan, Jon Huang, Josh Keller, Ian Lovett, Archie Tse and Karen Yourish.",http://www.nytimes.com/interactive/2014/03/26/us/houses-in-the-path-of-the-washington-mudslide.html13-Dec,benghazi,A Deadly Mix in Benghazi,"Design and graphics for an investigation by David D. Kirkpatrick into the deadly attack on American diplomats in Benghazi, Libya. With Joe Burgess, David Furst, Xaqu&iacute;n G.V., Jon Huang, Heather Murphy, Sergio Pe&ccedil;anha and Graham Roberts.",http://www.nytimes.com/projects/2013/benghazi/13-Nov,gunshots,Two Gunshots On a Summer Night,"Design and motion graphics for an investigation by Walt Bogdanich and Glenn Silber into how police have failed to investigate possible incidents of domestic violence by their own officers. With Nancy Donaldson, Mika Gr&ouml;ndahl, Xaqu&iacute;n G.V., Jon Huang, Graham Roberts and Catherine Spangler.",http://www.nytimes.com/projects/2013/two-gunshots/13-Aug,reshaping,Reshaping New York,"An interactive tour of how how the city changed in 12 years of Mayor Mike Bloomberg. With Ford Fessenden, Tom Giratikanon, Archie Tse, Tim Wallace, Derek Watkins, Jeremy White and Karen Yourish.",http://www.nytimes.com/newsgraphics/2013/08/18/reshaping-new-york/13-Jun,affirmative,How Minorities Have Fared in States With Affirmative Action Bans,An analysis with Ford Fessenden of how state bans on affirmative action in admissions have changed minority admissions at flagship universities. Portions of the graphic were <a href='https://twitter.com/aliciaparlap/status/458616945353306112'>cited and reproduced</a> in Justice Sotomayor&rsquo;s dissent in Schuette v. Coalition to Defend Affirmative Action.,http://www.nytimes.com/interactive/2013/06/24/us/affirmative-action-bans.html13-May,admissions,"At Top Colleges, an Admissions Gap for Minorities",Colleges with high graduation rates tend to enroll disproportionately low numbers of black and Hispanic students.,http://www.nytimes.com/interactive/2013/05/07/education/college-admissions-gap.html